Title,Authors,Citations
MEK inhibition overcomes chemoimmunotherapy resistance by inducing CXCL10 in cancer cells.,"Limagne E, Nuttin L, Thibaudin M, Jacquin E, Aucagne R, Bon M, Revy S, Barnestein R, Ballot E, Truntzer C, Derangère V, Fumet JD, Latour C, Rébé C, Bellaye PS, Kaderbhaï CG, Spill A, Collin B, Callanan MB, Lagrange A, Favier L, Coudert B, Arnould L, Ladoire S, Routy B, Joubert P, Ghiringhelli F.",Cancer Cell. 2022 Feb 14;40(2):136-152.e12. doi: 10.1016/j.ccell.2021.12.009. Epub 2022 Jan 19.
Vaccine booster efficiently inhibits entry of SARS-CoV-2 omicron variant.,"Zhang W, Huang L, Ye G, Geng Q, Ikeogu N, Harris M, Dileepan G, Burrack K, Du L, Frosch A, Li F.",Cell Mol Immunol. 2022 Jan 24:1-2. doi: 10.1038/s41423-022-00837-6. Online ahead of print.
Inflammasome Signaling in the Aging Brain and Age-Related Neurodegenerative Diseases.,"Brahadeeswaran S, Sivagurunathan N, Calivarathan L.",Mol Neurobiol. 2022 Jan 23. doi: 10.1007/s12035-021-02683-5. Online ahead of print.
BCAA-BCKA axis regulates WAT browning through acetylation of PRDM16.,"Ma QX, Zhu WY, Lu XC, Jiang D, Xu F, Li JT, Zhang L, Wu YL, Chen ZJ, Yin M, Huang HY, Lei QY.",Nat Metab. 2022 Jan;4(1):106-122. doi: 10.1038/s42255-021-00520-6. Epub 2022 Jan 24.
"Three waves changes, new variant strains, and vaccination effect against COVID-19 pandemic.","El-Shabasy RM, Nayel MA, Taher MM, Abdelmonem R, Shoueir KR, Kenawy ER.",Int J Biol Macromol. 2022 Jan 22;204:161-168. doi: 10.1016/j.ijbiomac.2022.01.118. Online ahead of print.
Peroxisomes Are Critical for the Development and Maintenance of B1 and Marginal Zone B Cells but Dispensable for Follicular B Cells and T Cells.,"Muri J, Corak B, Matsushita M, Baes M, Kopf M.",J Immunol. 2022 Feb 15;208(4):839-850. doi: 10.4049/jimmunol.2100518. Epub 2022 Jan 24.
Three FDA-approved therapies for chronic GVHD.,"Zeiser R, Lee SJ.",Blood. 2022 Jan 26:blood.2021014448. doi: 10.1182/blood.2021014448. Online ahead of print.
"Omicron variant (B.1.1.529) of SARS-CoV-2: Mutation, infectivity, transmission, and vaccine resistance.","Ren SY, Wang WB, Gao RD, Zhou AM.",World J Clin Cases. 2022 Jan 7;10(1):1-11. doi: 10.12998/wjcc.v10.i1.1.
Worldwide experience of homozygous familial hypercholesterolaemia: retrospective cohort study.,"Tromp TR, Hartgers ML, Hovingh GK, Vallejo-Vaz AJ, Ray KK, Soran H, Freiberger T, Bertolini S, Harada-Shiba M, Blom DJ, Raal FJ, Cuchel M; Homozygous Familial Hypercholesterolaemia International Clinical Collaborators.",Lancet. 2022 Feb 19;399(10326):719-728. doi: 10.1016/S0140-6736(21)02001-8. Epub 2022 Jan 28.
Clinical Characteristics of 100 Patients With Hypermobility Spectrum Disorders and Shoulder Complaints With or Without Mechanical Symptoms: A Cross-sectional Study.,"Liaghat B, Skou ST, Sondergaard J, Boyle E, Søgaard K, Juul-Kristensen B.",Arch Phys Med Rehabil. 2022 Jan 21:S0003-9993(22)00017-X. doi: 10.1016/j.apmr.2021.12.021. Online ahead of print.
Rapid epidemic expansion of the SARS-CoV-2 Omicron variant in southern Africa.,"Viana R, Moyo S, Amoako DG, Tegally H, Scheepers C, Althaus CL, Anyaneji UJ, Bester PA, Boni MF, Chand M, Choga WT, Colquhoun R, Davids M, Deforche K, Doolabh D, du Plessis L, Engelbrecht S, Everatt J, Giandhari J, Giovanetti M, Hardie D, Hill V, Hsiao NY, Iranzadeh A, Ismail A, Joseph C, Joseph R, Koopile L, Kosakovsky Pond SL, Kraemer MUG, Kuate-Lere L, Laguda-Akingba O, Lesetedi-Mafoko O, Lessells RJ, Lockman S, Lucaci AG, Maharaj A, Mahlangu B, Maponga T, Mahlakwane K, Makatini Z, Marais G, Maruapula D, Masupu K, Matshaba M, Mayaphi S, Mbhele N, Mbulawa MB, Mendes A, Mlisana K, Mnguni A, Mohale T, Moir M, Moruisi K, Mosepele M, Motsatsi G, Motswaledi MS, Mphoyakgosi T, Msomi N, Mwangi PN, Naidoo Y, Ntuli N, Nyaga M, Olubayo L, Pillay S, Radibe B, Ramphal Y, Ramphal U, San JE, Scott L, Shapiro R, Singh L, Smith-Lawrence P, Stevens W, Strydom A, Subramoney K, Tebeila N, Tshiabuila D, Tsui J, van Wyk S, Weaver S, Wibmer CK, Wilkinson E, Wolter N, Zarebski AE, Zuze B, Goedhals D, Preiser W, Treurnicht F, Venter M, Williamson C, Pybus OG, Bhiman J, Glass A, Martin DP, Rambaut A, Gaseitsiwe S, von Gottberg A, de Oliveira T.",Nature. 2022 Jan 7. doi: 10.1038/s41586-022-04411-y. Online ahead of print.
"Dapagliflozin reduces uric acid concentration, an independent predictor of adverse outcomes in DAPA-HF.","McDowell K, Welsh P, Docherty KF, Morrow DA, Jhund PS, de Boer RA, O'Meara E, Inzucchi SE, Køber L, Kosiborod MN, Martinez FA, Ponikowski P, Hammarstedt A, Langkilde AM, Sjöstrand M, Lindholm D, Solomon SD, Sattar N, Sabatine MS, McMurray JJV.",Eur J Heart Fail. 2022 Jan 22. doi: 10.1002/ejhf.2433. Online ahead of print.
High-speed fluorescence image-enabled cell sorting.,"Schraivogel D, Kuhn TM, Rauscher B, Rodríguez-Martínez M, Paulsen M, Owsley K, Middlebrook A, Tischer C, Ramasz B, Ordoñez-Rueda D, Dees M, Cuylen-Haering S, Diebold E, Steinmetz LM.",Science. 2022 Jan 21;375(6578):315-320. doi: 10.1126/science.abj3013. Epub 2022 Jan 20.
Searching for escape-resistant anti-SARS-CoV-2 neutralizing antibodies.,"Mahla RS, Dustin LB.",J Clin Invest. 2022 Feb 15;132(4):e157416. doi: 10.1172/JCI157416.
"Standards for the classification of pathogenicity of somatic variants in cancer (oncogenicity): Joint recommendations of Clinical Genome Resource (ClinGen), Cancer Genomics Consortium (CGC), and Variant Interpretation for Cancer Consortium (VICC).","Horak P, Griffith M, Danos AM, Pitel BA, Madhavan S, Liu X, Chow C, Williams H, Carmody L, Barrow-Laing L, Rieke D, Kreutzfeldt S, Stenzinger A, Tamborero D, Benary M, Rajagopal PS, Ida CM, Lesmana H, Satgunaseelan L, Merker JD, Tolstorukov MY, Campregher PV, Warner JL, Rao S, Natesan M, Shen H, Venstrom J, Roy S, Tao K, Kanagal-Shamanna R, Xu X, Ritter DI, Pagel K, Krysiak K, Dubuc A, Akkari YM, Li XS, Lee J, King I, Raca G, Wagner AH, Li MM, Plon SE, Kulkarni S, Griffith OL, Chakravarty D, Sonkin D.",Genet Med. 2022 Jan 28:S1098-3600(22)00001-6. doi: 10.1016/j.gim.2022.01.001. Online ahead of print.
Effect of Noninvasive Respiratory Strategies on Intubation or Mortality Among Patients With Acute Hypoxemic Respiratory Failure and COVID-19: The RECOVERY-RS Randomized Clinical Trial.,"Perkins GD, Ji C, Connolly BA, Couper K, Lall R, Baillie JK, Bradley JM, Dark P, Dave C, De Soyza A, Dennis AV, Devrell A, Fairbairn S, Ghani H, Gorman EA, Green CA, Hart N, Hee SW, Kimbley Z, Madathil S, McGowan N, Messer B, Naisbitt J, Norman C, Parekh D, Parkin EM, Patel J, Regan SE, Ross C, Rostron AJ, Saim M, Simonds AK, Skilton E, Stallard N, Steiner M, Vancheeswaran R, Yeung J, McAuley DF; RECOVERY-RS Collaborators.",JAMA. 2022 Feb 8;327(6):546-558. doi: 10.1001/jama.2022.0028.
Effects of a statewide pre-kindergarten program on children's achievement and behavior through sixth grade.,"Durkin K, Lipsey MW, Farran DC, Wiesen SE.",Dev Psychol. 2022 Jan 10. doi: 10.1037/dev0001301. Online ahead of print.
Iron: an underrated factor in aging.,Mangan D.,Aging (Albany NY). 2021 Oct 6;13(19):23407-23415. doi: 10.18632/aging.203612. Epub 2021 Oct 6.
Targeting PARP proteins in acute leukemia: DNA damage response inhibition and therapeutic strategies.,"Padella A, Ghelli Luserna Di Rorà A, Marconi G, Ghetti M, Martinelli G, Simonetti G.",J Hematol Oncol. 2022 Jan 22;15(1):10. doi: 10.1186/s13045-022-01228-0.
"Association of HLA gene polymorphism with susceptibility, severity, and mortality of COVID-19: A systematic review.","Deb P, Zannat KE, Talukder S, Bhuiyan AH, Jilani MSA, Saif-Ur-Rahman KM.",HLA. 2022 Jan 23. doi: 10.1111/tan.14560. Online ahead of print.
Genome-wide identification of the genetic basis of amyotrophic lateral sclerosis.,"Zhang S, Cooper-Knock J, Weimer AK, Shi M, Moll T, Marshall JNG, Harvey C, Nezhad HG, Franklin J, Souza CDS, Ning K, Wang C, Li J, Dilliott AA, Farhan S, Elhaik E, Pasniceanu I, Livesey MR, Eitan C, Hornstein E, Kenna KP; Project MinE ALS Sequencing Consortium, Veldink JH, Ferraiuolo L, Shaw PJ, Snyder MP.",Neuron. 2022 Jan 11:S0896-6273(21)01036-9. doi: 10.1016/j.neuron.2021.12.019. Online ahead of print.
Transition to invasive breast cancer is associated with progressive changes in the structure and composition of tumor stroma.,"Risom T, Glass DR, Averbukh I, Liu CC, Baranski A, Kagel A, McCaffrey EF, Greenwald NF, Rivero-Gutiérrez B, Strand SH, Varma S, Kong A, Keren L, Srivastava S, Zhu C, Khair Z, Veis DJ, Deschryver K, Vennam S, Maley C, Hwang ES, Marks JR, Bendall SC, Colditz GA, West RB, Angelo M.",Cell. 2022 Jan 20;185(2):299-310.e18. doi: 10.1016/j.cell.2021.12.023.
Systematic review of response criteria and endpoints in autoimmune hepatitis by the International Autoimmune Hepatitis Group.,"Pape S, Snijders RJALM, Gevers TJG, Chazouilleres O, Dalekos GN, Hirschfield GM, Lenzi M, Trauner M, Manns MP, Vierling JM, Montano-Loza AJ, Lohse AW, Schramm C, Drenth JPH, Heneghan MA; International Autoimmune Hepatitis Group (IAIHG) collaborators(‡).",J Hepatol. 2022 Jan 20:S0168-8278(22)00012-5. doi: 10.1016/j.jhep.2021.12.041. Online ahead of print.
Ancestral SARS-CoV-2-specific T cells cross-recognize the Omicron variant.,"Gao Y, Cai C, Grifoni A, Müller TR, Niessl J, Olofsson A, Humbert M, Hansson L, Österborg A, Bergman P, Chen P, Olsson A, Sandberg JK, Weiskopf D, Price DA, Ljunggren HG, Karlsson AC, Sette A, Aleman S, Buggert M.",Nat Med. 2022 Jan 14. doi: 10.1038/s41591-022-01700-x. Online ahead of print.
T cell responses to SARS-CoV-2 spike cross-recognize Omicron.,"Keeton R, Tincho MB, Ngomti A, Baguma R, Benede N, Suzuki A, Khan K, Cele S, Bernstein M, Karim F, Madzorera SV, Moyo-Gwete T, Mennen M, Skelem S, Adriaanse M, Mutithu D, Aremu O, Stek C, du Bruyn E, Van Der Mescht MA, de Beer Z, de Villiers TR, Bodenstein A, van den Berg G, Mendes A, Strydom A, Venter M, Giandhari J, Naidoo Y, Pillay S, Tegally H, Grifoni A, Weiskopf D, Sette A, Wilkinson RJ, de Oliveira T, Bekker LG, Gray G, Ueckermann V, Rossouw T, Boswell MT, Bihman J, Moore PL, Sigal A, Ntusi NAB, Burgers WA, Riou C.",Nature. 2022 Jan 31. doi: 10.1038/s41586-022-04460-3. Online ahead of print.
Drugs in semen.,"Pichini S, Zuccaro P, Pacifici R.",Clin Pharmacokinet. 1994 May;26(5):356-73. doi: 10.2165/00003088-199426050-00004.
"Propofol inhibits proliferation, migration, and invasion but promotes apoptosis by regulation of Sox4 in endometrial cancer cells.","Du Q, Liu J, Zhang X, Zhang X, Zhu H, Wei M, Wang S.",Braz J Med Biol Res. 2018;51(4):e6803. doi: 10.1590/1414-431x20176803. Epub 2018 Feb 26.
Clinical Outcomes Among Patients With 1-Year Survival Following Intensive Care Unit Treatment for COVID-19.,"Heesakkers H, van der Hoeven JG, Corsten S, Janssen I, Ewalds E, Simons KS, Westerhof B, Rettig TCD, Jacobs C, van Santen S, Slooter AJC, van der Woude MCE, van den Boogaard M, Zegers M.",JAMA. 2022 Feb 8;327(6):559-565. doi: 10.1001/jama.2022.0040.
"Why Was There Ever a Warning Not to Use Cephalosporins in the Setting of a Penicillin ""Allergy""?",Macy E.,J Allergy Clin Immunol Pract. 2021 Nov;9(11):3929-3933. doi: 10.1016/j.jaip.2021.06.059. Epub 2021 Jul 22.
Worsening of emergency department length of stay during the COVID-19 pandemic.,"Lucero A, Sokol K, Hyun J, Pan L, Labha J, Donn E, Kahwaji C, Miller G.",J Am Coll Emerg Physicians Open. 2021 Jun 22;2(3):e12489. doi: 10.1002/emp2.12489. eCollection 2021 Jun.
High-Strength and Injectable Supramolecular Hydrogel Self-Assembled by Monomeric Nucleoside for Tooth-Extraction Wound Healing.,"Wang Z, Zhang Y, Yin Y, Liu J, Li P, Zhao Y, Bai D, Zhao H, Han X, Chen Q.",Adv Mater. 2022 Jan 22:e2108300. doi: 10.1002/adma.202108300. Online ahead of print.
Androgen deprivation therapy use and duration with definitive radiotherapy for localised prostate cancer: an individual patient data meta-analysis.,"Kishan AU, Sun Y, Hartman H, Pisansky TM, Bolla M, Neven A, Steigler A, Denham JW, Feng FY, Zapatero A, Armstrong JG, Nabid A, Carrier N, Souhami L, Dunne MT, Efstathiou JA, Sandler HM, Guerrero A, Joseph D, Maingon P, de Reijke TM, Maldonado X, Ma TM, Romero T, Wang X, Rettig MB, Reiter RE, Zaorsky NG, Steinberg ML, Nickols NG, Jia AY, Garcia JA, Spratt DE; MARCAP Consortium group.",Lancet Oncol. 2022 Feb;23(2):304-316. doi: 10.1016/S1470-2045(21)00705-1. Epub 2022 Jan 17.
The subthalamic corticotropin-releasing hormone neurons mediate adaptive REM-sleep responses to threat.,"Tseng YT, Zhao B, Chen S, Ye J, Liu J, Liang L, Ding H, Schaefke B, Yang Q, Wang L, Wang F, Wang L.",Neuron. 2022 Jan 13:S0896-6273(21)01088-6. doi: 10.1016/j.neuron.2021.12.033. Online ahead of print.
Adult ADHD symptoms in a group of patients with substance abuse.,"Rad F, Buică A, Stancu M, Irimie-Ana A, Andrei E, Roşca D, Dobrescu I.",Riv Psichiatr. 2020 May-Jun;55(3):161-167. doi: 10.1708/3382.33572.
The microbiota regulates hematopoietic stem cell fate decisions by controlling iron availability in bone marrow.,"Zhang D, Gao X, Li H, Borger DK, Wei Q, Yang E, Xu C, Pinho S, Frenette PS.",Cell Stem Cell. 2022 Feb 3;29(2):232-247.e7. doi: 10.1016/j.stem.2021.12.009. Epub 2022 Jan 21.
Cellular architecture of human brain metastases.,"Gonzalez H, Mei W, Robles I, Hagerling C, Allen BM, Hauge Okholm TL, Nanjaraj A, Verbeek T, Kalavacherla S, van Gogh M, Georgiou S, Daras M, Phillips JJ, Spitzer MH, Roose JP, Werb Z.",Cell. 2022 Feb 17;185(4):729-745.e20. doi: 10.1016/j.cell.2021.12.043. Epub 2022 Jan 20.
"Neoadjuvant cemiplimab for resectable hepatocellular carcinoma: a single-arm, open-label, phase 2 trial.","Marron TU, Fiel MI, Hamon P, Fiaschi N, Kim E, Ward SC, Zhao Z, Kim J, Kennedy P, Gunasekaran G, Tabrizian P, Doroshow D, Legg M, Hammad A, Magen A, Kamphorst AO, Shareef M, Gupta NT, Deering R, Wang W, Wang F, Thanigaimani P, Mani J, Troncoso L, Tabachnikova A, Chang C, Akturk G, Buckup M, Hamel S, Ioannou G, Hennequin C, Jamal H, Brown H, Bonaccorso A, Labow D, Sarpel U, Rosenbloom T, Sung MW, Kou B, Li S, Jankovic V, James N, Hamon SC, Cheung HK, Sims JS, Miller E, Bhardwaj N, Thurston G, Lowy I, Gnjatic S, Taouli B, Schwartz ME, Merad M.",Lancet Gastroenterol Hepatol. 2022 Mar;7(3):219-229. doi: 10.1016/S2468-1253(21)00385-X. Epub 2022 Jan 20.
Ivermectin as an inhibitor of cancer stem‑like cells.,"Dominguez-Gomez G, Chavez-Blanco A, Medina-Franco JL, Saldivar-Gonzalez F, Flores-Torrontegui Y, Juarez M, Díaz-Chávez J, Gonzalez-Fierro A, Dueñas-González A.",Mol Med Rep. 2018 Feb;17(2):3397-3403. doi: 10.3892/mmr.2017.8231. Epub 2017 Dec 8.
"Do We Need a Cool-Down After Exercise? A Narrative Review of the Psychophysiological Effects and the Effects on Performance, Injuries and the Long-Term Adaptive Response.","Van Hooren B, Peake JM.",Sports Med. 2018 Jul;48(7):1575-1595. doi: 10.1007/s40279-018-0916-2.
Longitudinal analysis reveals high prevalence of Epstein-Barr virus associated with multiple sclerosis.,"Bjornevik K, Cortese M, Healy BC, Kuhle J, Mina MJ, Leng Y, Elledge SJ, Niebuhr DW, Scher AI, Munger KL, Ascherio A.",Science. 2022 Jan 21;375(6578):296-301. doi: 10.1126/science.abj8222. Epub 2022 Jan 13.
"Efficacy of the adjuvanted subunit protein COVID-19 vaccine, SCB-2019: a phase 2 and 3 multicentre, double-blind, randomised, placebo-controlled trial.","Bravo L, Smolenov I, Han HH, Li P, Hosain R, Rockhold F, Clemens SAC, Roa C Jr, Borja-Tabora C, Quinsaat A, Lopez P, López-Medina E, Brochado L, Hernández EA, Reynales H, Medina T, Velasquez H, Toloza LB, Rodriguez EJ, de Salazar DIM, Rodríguez CA, Sprinz E, Cerbino-Neto J, Luz KG, Schwarzbold AV, Paiva MS, Carlos J, Montellano MEB, de Los Reyes MRA, Yu CY, Alberto ER, Panaligan MM, Salvani-Bautista M, Buntinx E, Hites M, Martinot JB, Bhorat QE, Badat A, Baccarini C, Hu B, Jurgens J, Engelbrecht J, Ambrosino D, Richmond P, Siber G, Liang J, Clemens R.",Lancet. 2022 Jan 29;399(10323):461-472. doi: 10.1016/S0140-6736(22)00055-1. Epub 2022 Jan 20.
Amyloid-Related Imaging Abnormalities and β-Amyloid-Targeting Antibodies: A Systematic Review.,"Filippi M, Cecchetti G, Spinelli EG, Vezzulli P, Falini A, Agosta F.",JAMA Neurol. 2022 Jan 31. doi: 10.1001/jamaneurol.2021.5205. Online ahead of print.
Concussions in soccer: a current understanding.,"Levy ML, Kasasbeh AS, Baird LC, Amene C, Skeen J, Marshall L.",World Neurosurg. 2012 Nov;78(5):535-44. doi: 10.1016/j.wneu.2011.10.032. Epub 2011 Nov 1.
Long-Term Survival After Intravenous Thrombolysis for Ischemic Stroke: A Propensity Score-Matched Cohort With up to 10-Year Follow-Up.,"Muruet W, Rudd A, Wolfe CDA, Douiri A.",Stroke. 2018 Mar;49(3):607-613. doi: 10.1161/STROKEAHA.117.019889. Epub 2018 Feb 12.
Delayed introduction of progressive enteral feeds to prevent necrotising enterocolitis in very low birth weight infants.,"Young L, Oddie SJ, McGuire W.",Cochrane Database Syst Rev. 2022 Jan 20;1(1):CD001970. doi: 10.1002/14651858.CD001970.pub6.
Handgrip Strength Asymmetry and Weakness Are Associated With Future Morbidity Accumulation in Americans.,"Klawitter L, Vincent BM, Choi BJ, Smith J, Hammer KD, Jurivich DA, Dahl LJ, McGrath R.",J Strength Cond Res. 2022 Jan 1;36(1):106-112. doi: 10.1519/JSC.0000000000004166.
PROTAC targeted protein degraders: the past is prologue.,"Békés M, Langley DR, Crews CM.",Nat Rev Drug Discov. 2022 Jan 18:1-20. doi: 10.1038/s41573-021-00371-6. Online ahead of print.
Post-SARS-CoV-2 vaccination venous sinus thrombosis: a literature review of 308 cases.,"Finsterer J, Zarrouk S.",Egypt J Neurol Psychiatr Neurosurg. 2021;57(1):179. doi: 10.1186/s41983-021-00431-z. Epub 2021 Dec 20.
Suicide with hydrogen sulfide.,"Sams RN, Carver HW 2nd, Catanese C, Gilson T.",Am J Forensic Med Pathol. 2013 Jun;34(2):81-2. doi: 10.1097/PAF.0b013e3182886d35.
Fasting improves therapeutic response in hepatocellular carcinoma through p53-dependent metabolic synergism.,"Krstic J, Reinisch I, Schindlmaier K, Galhuber M, Riahi Z, Berger N, Kupper N, Moyschewitz E, Auer M, Michenthaler H, Nössing C, Depaoli MR, Ramadani-Muja J, Usluer S, Stryeck S, Pichler M, Rinner B, Deutsch AJA, Reinisch A, Madl T, Chiozzi RZ, Heck AJR, Huch M, Malli R, Prokesch A.",Sci Adv. 2022 Jan 21;8(3):eabh2635. doi: 10.1126/sciadv.abh2635. Epub 2022 Jan 21.
"SER-109, an Oral Microbiome Therapy for Recurrent Clostridioides difficile Infection.","Feuerstadt P, Louie TJ, Lashner B, Wang EEL, Diao L, Bryant JA, Sims M, Kraft CS, Cohen SH, Berenson CS, Korman LY, Ford CB, Litcofsky KD, Lombardo MJ, Wortman JR, Wu H, Auniņš JG, McChalicher CWJ, Winkler JA, McGovern BH, Trucksis M, Henn MR, von Moltke L.",N Engl J Med. 2022 Jan 20;386(3):220-229. doi: 10.1056/NEJMoa2106516.
SARS-CoV-2 Beta variant infection elicits potent lineage-specific and cross-reactive antibodies.,"Reincke SM, Yuan M, Kornau HC, Corman VM, van Hoof S, Sánchez-Sendin E, Ramberger M, Yu W, Hua Y, Tien H, Schmidt ML, Schwarz T, Jeworowski LM, Brandl SE, Rasmussen HF, Homeyer MA, Stöffler L, Barner M, Kunkel D, Huo S, Horler J, von Wardenburg N, Kroidl I, Eser TM, Wieser A, Geldmacher C, Hoelscher M, Gänzer H, Weiss G, Schmitz D, Drosten C, Prüss H, Wilson IA, Kreye J.",Science. 2022 Feb 18;375(6582):782-787. doi: 10.1126/science.abm5835. Epub 2022 Jan 25.
Emergence of Omicron third lineage BA.3 and its importance.,"Desingu PA, Nagarajan K, Dhama K.",J Med Virol. 2022 Jan 18. doi: 10.1002/jmv.27601. Online ahead of print.
Association Between 3 Doses of mRNA COVID-19 Vaccine and Symptomatic Infection Caused by the SARS-CoV-2 Omicron and Delta Variants.,"Accorsi EK, Britton A, Fleming-Dutra KE, Smith ZR, Shang N, Derado G, Miller J, Schrag SJ, Verani JR.",JAMA. 2022 Feb 15;327(7):639-651. doi: 10.1001/jama.2022.0470.
The importance of midlife diet in late life cognitive outcomes.,"Bazzano LA, Woltz SG.",Am J Clin Nutr. 2022 Feb 9;115(2):323-324. doi: 10.1093/ajcn/nqab413.
RALF peptide signaling controls the polytubey block in Arabidopsis.,"Zhong S, Li L, Wang Z, Ge Z, Li Q, Bleckmann A, Wang J, Song Z, Shi Y, Liu T, Li L, Zhou H, Wang Y, Zhang L, Wu HM, Lai L, Gu H, Dong J, Cheung AY, Dresselhaus T, Qu LJ.",Science. 2022 Jan 21;375(6578):290-296. doi: 10.1126/science.abl4683. Epub 2022 Jan 20.
How does Omicron spread so fast? A high viral load isn't the answer.,Kozlov M.,Nature. 2022 Jan 19. doi: 10.1038/d41586-022-00129-z. Online ahead of print.
Phosphorylated TDP-43 aggregates in peripheral motor nerves of patients with amyotrophic lateral sclerosis.,"Riva N, Gentile F, Cerri F, Gallia F, Podini P, Dina G, Falzone YM, Fazio R, Lunetta C, Calvo A, Logroscino G, Lauria G, Corbo M, Iannaccone S, Chiò A, Lazzerini A, Nobile-Orazio E, Filippi M, Quattrini A.",Brain. 2022 Jan 25:awab285. doi: 10.1093/brain/awab285. Online ahead of print.
Whey Protein Supplementation Is Superior to Leucine-Matched Collagen Peptides to Increase Muscle Thickness During a 10-Week Resistance Training Program in Untrained Young Adults.,"Jacinto JL, Nunes JP, Gorissen SHM, Capel DMG, Bernardes AG, Ribeiro AS, Cyrino ES, Phillips SM, Aguiar AF.",Int J Sport Nutr Exerc Metab. 2022 Jan 17:1-11. doi: 10.1123/ijsnem.2021-0265. Online ahead of print.
The SARS-CoV-2 mutations versus vaccine effectiveness: New opportunities to new challenges.,"Malik JA, Ahmed S, Mir A, Shinde M, Bender O, Alshammari F, Ansari M, Anwar S.",J Infect Public Health. 2022 Feb;15(2):228-240. doi: 10.1016/j.jiph.2021.12.014. Epub 2022 Jan 5.
Carboxyatractyloside poisoning in humans.,"Turgut M, Alhan CC, Gürgöze M, Kurt A, Doğan Y, Tekatli M, Akpolat N, Aygün AD.",Ann Trop Paediatr. 2005 Jun;25(2):125-34. doi: 10.1179/146532805X45728.
The Omicron variant is highly resistant against antibody-mediated neutralization: Implications for control of the COVID-19 pandemic.,"Hoffmann M, Krüger N, Schulz S, Cossmann A, Rocha C, Kempf A, Nehlmeier I, Graichen L, Moldenhauer AS, Winkler MS, Lier M, Dopfer-Jablonka A, Jäck HM, Behrens GMN, Pöhlmann S.",Cell. 2022 Feb 3;185(3):447-456.e11. doi: 10.1016/j.cell.2021.12.032. Epub 2021 Dec 24.
"Effectiveness of COVID-19 booster vaccines against covid-19 related symptoms, hospitalisation and death in England.","Andrews N, Stowe J, Kirsebom F, Toffa S, Sachdeva R, Gower C, Ramsay M, Bernal JL.",Nat Med. 2022 Jan 14. doi: 10.1038/s41591-022-01699-1. Online ahead of print.
On-site placement of resuscitative endovascular balloon occlusion of the aorta (REBOA) in a hemorrhagic shock patient: A successful endeavor involving long-distance air transport.,"Ando H, Kaszynski RH, Goto H.",Am J Emerg Med. 2021 Dec 28:S0735-6757(21)01026-3. doi: 10.1016/j.ajem.2021.12.055. Online ahead of print.
"Targeting flavin-containing enzymes eliminates cancer stem cells (CSCs), by inhibiting mitochondrial respiration: Vitamin B2 (Riboflavin) in cancer therapy.","Ozsvari B, Bonuccelli G, Sanchez-Alvarez R, Foster R, Sotgia F, Lisanti MP.",Aging (Albany NY). 2017 Dec 16;9(12):2610-2628. doi: 10.18632/aging.101351.
Immunogenicity and Reactogenicity of Vaccine Boosters after Ad26.COV2.S Priming.,"Sablerolles RSG, Rietdijk WJR, Goorhuis A, Postma DF, Visser LG, Geers D, Schmitz KS, Garcia Garrido HM, Koopmans MPG, Dalm VASH, Kootstra NA, Huckriede ALW, Lafeber M, van Baarle D, GeurtsvanKessel CH, de Vries RD, van der Kuy PHM; SWITCH Research Group.",N Engl J Med. 2022 Jan 19:NEJMoa2116747. doi: 10.1056/NEJMoa2116747. Online ahead of print.
Lifting Techniques: Why Are We Not Using Evidence To Optimize Movement?,"Washmuth NB, McAfee AD, Bickel CS.",Int J Sports Phys Ther. 2022 Jan 1;17(1):104-110. doi: 10.26603/001c.30023. eCollection 2022.
SARS-CoV-2 Omicron variant: Antibody evasion and cryo-EM structure of spike protein-ACE2 complex.,"Mannar D, Saville JW, Zhu X, Srivastava SS, Berezuk AM, Tuttle KS, Marquez AC, Sekirov I, Subramaniam S.",Science. 2022 Feb 18;375(6582):760-764. doi: 10.1126/science.abn7760. Epub 2022 Jan 20.
Maximizing the Benefit of Screening for Adverse Childhood Experiences.,"Jee S, Forkey H.",Pediatrics. 2022 Feb 1;149(2):e2021054624. doi: 10.1542/peds.2021-054624.
Ageing exacerbates ribosome pausing to disrupt cotranslational proteostasis.,"Stein KC, Morales-Polanco F, van der Lienden J, Rainbolt TK, Frydman J.",Nature. 2022 Jan;601(7894):637-642. doi: 10.1038/s41586-021-04295-4. Epub 2022 Jan 19.
Early detection of obstructive coronary artery disease in the asymptomatic high-risk population: objectives and study design of the EARLY-SYNERGY trial.,"Ties D, van Dorp P, Pundziute G, van der Aalst CM, Gratama JWC, Braam RL, Kuijpers D, Lubbers DD, van der Bilt IAC, Westenbrink BD, Wolcherink MJO, Doggen CJM, Išgum I, Nijveldt R, de Koning HJ, Vliegenthart R, Oudkerk M, van der Harst P.",Am Heart J. 2022 Jan 14;246:166-177. doi: 10.1016/j.ahj.2022.01.005. Online ahead of print.
The Lysosomal Rag-Ragulator Complex Licenses RIPK1 and Caspase-8-mediated Pyroptosis by Yersinia.,"Zheng Z, Deng W, Bai Y, Miao R, Mei S, Zhang Z, Pan Y, Wang Y, Min R, Deng F, Wu Z, Li W, Chen P, Ma T, Lou X, Lieberman J, Liu X.",Science. 2021 Jun 25;372(6549):eabg0269. doi: 10.1126/science.abg0269.
Projections from neocortex mediate top-down control of memory retrieval.,"Rajasethupathy P, Sankaran S, Marshel JH, Kim CK, Ferenczi E, Lee SY, Berndt A, Ramakrishnan C, Jaffe A, Lo M, Liston C, Deisseroth K.",Nature. 2015 Oct 29;526(7575):653-9. doi: 10.1038/nature15389. Epub 2015 Oct 5.
An infectious SARS-CoV-2 B.1.1.529 Omicron virus escapes neutralization by therapeutic monoclonal antibodies.,"VanBlargan LA, Errico JM, Halfmann PJ, Zost SJ, Crowe JE Jr, Purcell LA, Kawaoka Y, Corti D, Fremont DH, Diamond MS.",Nat Med. 2022 Jan 19:1-6. doi: 10.1038/s41591-021-01678-y. Online ahead of print.
Use of remdesivir in the presence of elevated LFTs for the treatment of severe COVID-19 infection.,"Sabers AJ, Williams AL, Farley TM.",BMJ Case Rep. 2020 Oct 31;13(10):e239210. doi: 10.1136/bcr-2020-239210.
How to manage traumatic brain injury without invasive monitoring?,"Godoy DA, Rabinstein AA.",Curr Opin Crit Care. 2022 Apr 1;28(2):111-122. doi: 10.1097/MCC.0000000000000914.
